{
  "all_final_file_sha256_recomputed": true,
  "artifact_id": "action-interpretation-final-byte-parity:f000477:justice_public_safety:119:v3",
  "candidate_batch_content_subject_sha256": "d906902fcf80192b4a966bf7f9934d2346d505be1a4e0c830b20e1a019dd6219",
  "candidate_batch_file_sha256": "ce5ad2b97cddb762028220abcb8d3f524d5f834c3ebe1e36bd307c3058bd2072",
  "canonical_artifacts": [
    {
      "content_subject_sha256": "3adee84a5f8fde814a46293921e1258a62243a4cfc9bb7e9af1d0e69cc6bc708",
      "digest_semantics": "canonical parsed JSON subject; final serialized file bytes",
      "file_sha256": "c0d2ef68c39f41a13ce8e430e01848577c2735c6fa791a2fdbd889b239ffdfc2",
      "path": "docs/editorial/full_record_reviews/interpretation_candidates/f000477_justice_public_safety_119_v3/benchmark_comparison.json"
    },
    {
      "content_subject_sha256": "09a63f1674e87d8ec3c189aa90e44a21f1903c9d500e1bec9f6fa2554ee90c8e",
      "digest_semantics": "canonical parsed JSON subject; final serialized file bytes",
      "file_sha256": "a62bb0f719456534605dc7510753b220bc51fb14c8930114fc95f96c7814a170",
      "path": "docs/editorial/full_record_reviews/interpretation_candidates/f000477_justice_public_safety_119_v3/bounded_correction_diff.json"
    },
    {
      "content_subject_sha256": "d906902fcf80192b4a966bf7f9934d2346d505be1a4e0c830b20e1a019dd6219",
      "digest_semantics": "canonical parsed JSON subject; final serialized file bytes",
      "file_sha256": "ce5ad2b97cddb762028220abcb8d3f524d5f834c3ebe1e36bd307c3058bd2072",
      "path": "docs/editorial/full_record_reviews/interpretation_candidates/f000477_justice_public_safety_119_v3/candidate_batch.json"
    },
    {
      "content_subject_sha256": "b8fb631e8142b302c2f0be38a691f58cd0856ea5cda9782ad843ae26170a558c",
      "digest_semantics": "canonical parsed JSON subject; final serialized file bytes",
      "file_sha256": "665bb4dd35c0a86eefc64086ea42a163e9546bc257a101640ac02fcf6f1e858f",
      "path": "docs/editorial/full_record_reviews/interpretation_candidates/f000477_justice_public_safety_119_v3/cross_field_consistency_reviews.json"
    },
    {
      "content_subject_sha256": "475c1e44573c7d8a5f2731d868c77800997ee094c65debe8f0638a6376d32943",
      "digest_semantics": "canonical parsed JSON subject; final serialized file bytes",
      "file_sha256": "92bfdbfbc564f2c47f219fc0ae59cb288ce3bfe6fc49927d196817a582b2ef8c",
      "path": "docs/editorial/full_record_reviews/interpretation_candidates/f000477_justice_public_safety_119_v3/evidence_maps.json"
    },
    {
      "content_subject_sha256": "1be919023c055cf511a1110f670595fc97e27af6ae593e9d78fedc4429bc35c7",
      "digest_semantics": "canonical parsed JSON subject; final serialized file bytes",
      "file_sha256": "5ef7db83b7febcba5059efdfdb95376e8f8b3df32a5b613c747c309198e12315",
      "path": "docs/editorial/full_record_reviews/interpretation_candidates/f000477_justice_public_safety_119_v3/expected_provision_inventories.json"
    },
    {
      "content_subject_sha256": "19f52ad8feb0849f5d881e2a81dc61be1a3c087ff1ae082525aef6d6c6986c5b",
      "digest_semantics": "canonical parsed JSON subject; final serialized file bytes",
      "file_sha256": "e5f5be7f424b0e5f5c47fc589c8d361b60bd7cfd800c046479f3490724c935e4",
      "path": "docs/editorial/full_record_reviews/interpretation_candidates/f000477_justice_public_safety_119_v3/human_decision_template.json"
    },
    {
      "content_subject_sha256": "15b8b20d1805c3fe23fdf9698cbf28f195c4cd8e939e8ad7d291f5c2a7fe0498",
      "digest_semantics": "canonical parsed JSON subject; final serialized file bytes",
      "file_sha256": "25b79c818baeb5121944c0151a181bfd783444337dcea1b6f9ded80bc2e414e7",
      "path": "docs/editorial/full_record_reviews/interpretation_candidates/f000477_justice_public_safety_119_v3/initial_candidate_batch.json"
    },
    {
      "content_subject_sha256": "ceae7c37709a5973d92c4535d14948128e539f80450bafe205d6a790fdef7218",
      "digest_semantics": "canonical parsed JSON subject; final serialized file bytes",
      "file_sha256": "300cd12d137a4171bed02c39ef3ccf5a96c69954d54e3da93db1fc698049eb4c",
      "path": "docs/editorial/full_record_reviews/interpretation_candidates/f000477_justice_public_safety_119_v3/related_action_differential_reviews.json"
    },
    {
      "content_subject_sha256": "38483c767b481cf722068db937ddbdb9624a586e4555ea532604d8955c565a41",
      "digest_semantics": "canonical parsed JSON subject; final serialized file bytes",
      "file_sha256": "d9a8b2cb26fab815e09b013eae6d9ed309d547073cb769f6345591b1e7e1bbd7",
      "path": "docs/editorial/full_record_reviews/interpretation_candidates/f000477_justice_public_safety_119_v3/related_action_lineage_map.json"
    },
    {
      "content_subject_sha256": "bdf628789a980c2477e3553689d97ac07fdb88abe8e16325fd49f541f92020ac",
      "digest_semantics": "canonical parsed JSON subject; final serialized file bytes",
      "file_sha256": "13318cc793b2d1d33adffad32cda44dd0918c2d0c256aa2686ac14fa29c3bc4b",
      "path": "docs/editorial/full_record_reviews/interpretation_candidates/f000477_justice_public_safety_119_v3/review_contracts.json"
    },
    {
      "content_subject_sha256": "9e934228258416f4ce296a8fb931f92441e4c0c55b345d965d143fd73ee29282",
      "digest_semantics": "canonical parsed JSON subject; final serialized file bytes",
      "file_sha256": "01dcb345a07aa8d92ef8d9ac5f267527f0fe6a20a2c883a26242d44475759cdb",
      "path": "docs/editorial/full_record_reviews/interpretation_candidates/f000477_justice_public_safety_119_v3/revision_directive.json"
    },
    {
      "content_subject_sha256": "511c5587c887d738a7b6d05bf73410866583ddff2e546c4ab37441a9c72526d6",
      "digest_semantics": "canonical parsed JSON subject; final serialized file bytes",
      "file_sha256": "a6a936c00c116806c576afecf4ded8cfb4001ccaf17d2d355923d48734b9fb9c",
      "path": "docs/editorial/full_record_reviews/interpretation_candidates/f000477_justice_public_safety_119_v3/sample_manifest.json"
    },
    {
      "content_subject_sha256": "14776e50faa5be22aea592549fe814fb2acf07fd8caa2653297f83e058189795",
      "digest_semantics": "canonical parsed JSON subject; final serialized file bytes",
      "file_sha256": "9e6ab0a0d369ac1ccaf8dd93aa1cb33a3dd164ff0ea30b2fd933125cce1664c5",
      "path": "docs/editorial/full_record_reviews/interpretation_candidates/f000477_justice_public_safety_119_v3/schemas/benchmark_comparison_v3.schema.json"
    },
    {
      "content_subject_sha256": "cd9fe8d646e09c129defa88e886218217e53677030af3919f4b807883dbe5801",
      "digest_semantics": "canonical parsed JSON subject; final serialized file bytes",
      "file_sha256": "7708610229d0abcca80af0a4e51ecbcb62ecb894fa786e109f30dd8bea05fd1a",
      "path": "docs/editorial/full_record_reviews/interpretation_candidates/f000477_justice_public_safety_119_v3/schemas/bounded_correction_diff_v3.schema.json"
    },
    {
      "content_subject_sha256": "8271967e769551f03bb7e4abdc897bab29a8f9af892abf478105ea547f41db48",
      "digest_semantics": "canonical parsed JSON subject; final serialized file bytes",
      "file_sha256": "2b6873e8501a2485730ae377fe792d5d583aac8f4a44d5957e41c40942558297",
      "path": "docs/editorial/full_record_reviews/interpretation_candidates/f000477_justice_public_safety_119_v3/schemas/candidate_batch_v3.schema.json"
    },
    {
      "content_subject_sha256": "90309b88ab1dcf39a10baa78fe92aa9442497c979775f57afd01ff0069dddbf8",
      "digest_semantics": "canonical parsed JSON subject; final serialized file bytes",
      "file_sha256": "28ac4595e4840dbd78d28dc1743a4bd2c24bf67a7767f6373d918a3cf014feae",
      "path": "docs/editorial/full_record_reviews/interpretation_candidates/f000477_justice_public_safety_119_v3/schemas/cross_field_consistency_reviews_v3.schema.json"
    },
    {
      "content_subject_sha256": "d09951851f4282f277fda447ae4ee84c536d9780c4f15017acd27472b5c702ed",
      "digest_semantics": "canonical parsed JSON subject; final serialized file bytes",
      "file_sha256": "3966a2dc601bcdf9ed0a170730636101a57b644e7890896e7bfa58a92651788f",
      "path": "docs/editorial/full_record_reviews/interpretation_candidates/f000477_justice_public_safety_119_v3/schemas/evidence_maps_v3.schema.json"
    },
    {
      "content_subject_sha256": "3b42a45fd20e39afa6dee0089fd985cdb74d80dde5be3efc4f92100c69f3964f",
      "digest_semantics": "canonical parsed JSON subject; final serialized file bytes",
      "file_sha256": "8c06af9fd268a1a49b755b80ebbbe4f29c349e3e7c3b33441dbaba4f9fed16f9",
      "path": "docs/editorial/full_record_reviews/interpretation_candidates/f000477_justice_public_safety_119_v3/schemas/expected_provision_inventories_v3.schema.json"
    },
    {
      "content_subject_sha256": "dafb361ab62368b7cd31ff490cfbab1ff1c4a1ad72b04d2b13e119de0134ae66",
      "digest_semantics": "canonical parsed JSON subject; final serialized file bytes",
      "file_sha256": "612441d0d8fc1dec9971389e844a2977ac135b0bdcca1996e1a4cd8c05a3fcda",
      "path": "docs/editorial/full_record_reviews/interpretation_candidates/f000477_justice_public_safety_119_v3/schemas/human_decision_template_v3.schema.json"
    },
    {
      "content_subject_sha256": "2f3d52794cb190717d02cd05d4e542c327a262219f4c7ebb9412ee52a8e40e13",
      "digest_semantics": "canonical parsed JSON subject; final serialized file bytes",
      "file_sha256": "61bf196f73418292fcbb627cf3000e90e76c2275ffebbe7097c1d4feeee4939e",
      "path": "docs/editorial/full_record_reviews/interpretation_candidates/f000477_justice_public_safety_119_v3/schemas/initial_candidate_batch_v3.schema.json"
    },
    {
      "content_subject_sha256": "8e699280e84ca9574f9a7eb679b8cdfe69e7ca4bb8f70c5967ffe45a4f17e09b",
      "digest_semantics": "canonical parsed JSON subject; final serialized file bytes",
      "file_sha256": "e896d6c5bc50e612ed583363f9ffaa45eaa31b6008791e6058247c921bc0a6e3",